{
  "$schema": "https://json-schema.org/draft/2020-12/schema",
  "$id": "https://skill-map.dev/spec/v0/summaries/markdown.schema.json",
  "title": "SummaryMarkdown",
  "description": "Report produced by `markdown-summarizer` for a single `markdown` node (the format-named generic fallback owned by the built-in `core/markdown` Provider — see `architecture.md` §Provider · dispatch order). Extends `report-base.schema.json`. Stability: experimental.",
  "allOf": [
    { "$ref": "../report-base.schema.json" }
  ],
  "type": "object",
  "required": ["whatItCovers"],
  "additionalProperties": false,
  "properties": {
    "confidence": true,
    "safety": true,
    "whatItCovers": {
      "type": "string",
      "description": "One-sentence summary of the file's subject matter. REQUIRED. Named distinctly from `whatItDoes` since markdown notes describe, not act."
    },
    "topics": {
      "type": "array",
      "description": "Topical tags inferred from the body. Feed into tag-based discovery and `related` link inference.",
      "items": { "type": "string" }
    },
    "keyFacts": {
      "type": "array",
      "description": "Discrete claims or data points the file asserts. Useful for search and diffing over time.",
      "items": { "type": "string" }
    },
    "relatedNodes": {
      "type": "array",
      "items": { "type": "string" }
    },
    "qualityNotes": {
      "type": "string"
    }
  }
}
